title,disaster_type,date,latitude,longitude,source,url,severity
Gavins Point Dam Water Release Yankton South Dakota 2011,Other,2024-10-15T14:49:48,,,Reddit/flooding,https://youtube.com/shorts/H4M6BicCQEo?si=66j1vbDNXzuBm1-d,Low
Flooding in FL,flood,2024-10-03T03:36:35,,,Reddit/flooding,https://www.reddit.com/r/Flooding/comments/1fuytol/flooding_in_fl/,Low
And how was your day,Other,2024-09-21T15:37:06,,,Reddit/flooding,https://v.redd.it/4lp1d4gp45qd1,Low
Campti Louisiana Flooding ,flood,2024-07-26T17:40:41,,,Reddit/flooding,https://v.redd.it/cwsneyjlgwed1,Low
Campti Louisiana Flooding ,flood,2024-07-26T17:39:33,,,Reddit/flooding,https://v.redd.it/0gftz18egwed1,Low
The NHC released its Tropical Cyclone Report for Hurricane Oscar (19-22 October 2024) in the northern Atlantic,hurricane,2025-03-11T16:55:09,39.5143268,-74.6632883,Reddit/tropicalweather,https://www.nhc.noaa.gov/data/tcr/AL162024_Oscar.pdf,Low
"""Near average"" upcoming season.",Other,2025-03-11T14:33:07,,,Reddit/tropicalweather,https://www.reddit.com/r/TropicalWeather/comments/1j8s4xq/near_average_upcoming_season/,Low
What Was Behind Idalia’s Rapid Intensification?,Other,2025-03-10T19:35:03,,,Reddit/tropicalweather,https://earthobservatory.nasa.gov/images/154018/what-was-behind-idalias-rapid-intensification,Low
The NHC released its Tropical Cyclone Report for Hurricane Rafael (4-10 November 2024) in the northern Atlantic,hurricane,2025-03-10T18:55:47,39.5143268,-74.6632883,Reddit/tropicalweather,https://www.nhc.noaa.gov/data/tcr/AL182024_Rafael.pdf,Low
The NHC released its Tropical Cyclone Report for Hurricane Francine (9-12 September 2024) in the northern Atlantic,hurricane,2025-03-10T18:55:44,39.5143268,-74.6632883,Reddit/tropicalweather,https://www.nhc.noaa.gov/data/tcr/AL062024_Francine.pdf,Low
The NHC released its Tropical Cyclone Report for Hurricane Ernesto (12-20 August 2024) in the northern Atlantic,hurricane,2025-03-10T18:55:42,39.5143268,-74.6632883,Reddit/tropicalweather,https://www.nhc.noaa.gov/data/tcr/AL052024_Ernesto.pdf,Low
The NHC released its Tropical Cyclone Report for Tropical Storm Sara (14-18 November 2024) in the northern Atlantic,hurricane,2025-03-10T18:55:39,39.5143268,-74.6632883,Reddit/tropicalweather,https://www.nhc.noaa.gov/data/tcr/AL192024_Sara.pdf,Low
Does anyone know what happened to WTVJ Meteorologist Brien Allen?,Other,2025-03-10T00:32:51,,,Reddit/tropicalweather,https://i.redd.it/ama0e9t5crne1.jpeg,Low
Global Tropical Outlook & Discussion: 10-16 March 2025,Other,2025-03-10T06:55:12,,,Reddit/tropicalweather,https://www.reddit.com/r/TropicalWeather/comments/1j7srag/global_tropical_outlook_discussion_1016_march_2025/,Low
Jude (25S — Mozambique Channel),Other,2025-03-09T03:35:53,,,Reddit/tropicalweather,https://www.reddit.com/r/TropicalWeather/comments/1j6yqni/jude_25s_mozambique_channel/,Low
Sudden increased activity Santorini Thera Station?,Other,2025-03-14T08:53:16,,,Reddit/volcanoes,https://i.redd.it/483sizt2dmoe1.jpeg,Low
Clouds form over volcanic fields because of various gasses and particles. Heres a cloud over the Sylingarfell Iceland site,volcano,2025-03-13T20:33:57,,,Reddit/volcanoes,https://www.reddit.com/r/Volcanoes/comments/1jalzyw/clouds_form_over_volcanic_fields_because_of/,Low
"Stromboli, June 21, 2024",Other,2025-03-13T18:48:16,38.791796250000004,15.211175249544858,Reddit/volcanoes,https://i.redd.it/v6defytb6ioe1.jpeg,Low
Mount Spurr (Alaska) eruption becoming more likely,volcano,2025-03-13T12:38:45,61.2989571,-152.253454,Reddit/volcanoes,https://www.alaskasnewssource.com/video/2025/03/13/mount-spurr-erruption-becoming-more-likely/,Low
White mist in Mt. St. Helens blast cloud?,Other,2025-03-13T07:06:51,46.191391,-122.195527,Reddit/volcanoes,https://www.reddit.com/r/Volcanoes/comments/1ja69ka/white_mist_in_mt_st_helens_blast_cloud/,Low
4.4 earthquake in Campi Flegrei,earthquake,2025-03-13T06:21:11,42.27125,9.42283,Reddit/volcanoes,https://i.redd.it/efwhihf1heoe1.jpeg,Low
From devastation point during Kilauea’s 3/11/25 episode.,Other,2025-03-13T04:52:20,,,Reddit/volcanoes,https://i.redd.it/js3coxy51eoe1.jpeg,Moderate
"Fear in Campi Flegrei: earthquake of magnitude 4,4 recorded",earthquake,2025-03-13T03:45:38,,,Reddit/volcanoes,https://www.agenzianova.com/en/news/Fear-in-the-Phlegraean-Fields%3A-44-magnitude-earthquake-recorded/,Low
2004 9.x earthquake/tsunami to eruption changes…,earthquake,2025-03-12T23:30:23,,,Reddit/volcanoes,https://www.reddit.com/r/Volcanoes/comments/1j9y4cu/2004_9x_earthquaketsunami_to_eruption_changes/,Low
Popocatépetl volcano live,volcano,2025-03-12T21:45:49,,,Reddit/volcanoes,https://www.youtube.com/live/eIZsAn-_hrw?si=3GoxR0Yxqii9Uj6D,Low
Tsunami warning for Caribbean due to 7.6 earthquake,earthquake,2025-02-09T01:29:47,50.41123695962111,16.45679466967772,Reddit/tsunami,https://www.tsunami.gov/?p=PHEB/2025/02/08/25039000/4/WECA41,Low
Tsunami Warning,tsunami,2024-12-05T20:26:19,,,Reddit/tsunami,https://www.reddit.com/r/Tsunami/comments/1h7ivyw/tsunami_warning/,Low
"A mega-tsunami in the Pacific north-west? It could be worse than predicted, study says",tsunami,2024-03-03T10:55:32,46.5334929,-123.768029,Reddit/tsunami,https://www.theguardian.com/world/2022/jun/07/tsunami-earthquake-pacific-northwest-coast-us-study,Low
The Earthquake That Will Devastate the Pacific Northwest,earthquake,2024-03-03T10:55:08,,,Reddit/tsunami,https://www.newyorker.com/magazine/2015/07/20/the-really-big-one,Low
"Today, Fri 14th Risk Zone has expanded- 75+mph damaging winds, Tornadoes, Hail. See comments.",tornado,2025-03-14T10:52:43,,,Reddit/StormComing,https://i.redd.it/j0g7kpu5ymoe1.jpeg,Low
"A severe weather outbreak is expected on Saturday. Numerous significant tornadoes are possible on Saturday afternoon and evening, centered on eastern Louisiana, Mississippi, and Alabama.",tornado,2025-03-14T00:21:35,30.8703881,-92.007126,Reddit/StormComing,https://i.redd.it/0duf26dqtjoe1.jpeg,Low
A regional outbreak of severe storms is likely over the Lower/Mid-Missouri/Mississippi Valleys and Lower Ohio Valley late Friday afternoon into Saturday morning,storm,2025-03-13T23:31:43,,,Reddit/StormComing,https://i.redd.it/i4ejbfdkkjoe1.png,Low
Earthquake causes panic and damages homes in Naples,earthquake,2025-03-13T21:54:22,40.8358846,14.2487679,Reddit/StormComing,https://www.telegraph.co.uk/world-news/2025/03/13/naples-residents-on-streets-earthquake-campi-flegrei/,Low
Assessing the Global Climate in February 2025: Above-average temperatures over most areas; lowest global and Arctic sea ice extent,Other,2025-03-13T20:10:55,70.672687,23.6569867,Reddit/StormComing,https://www.ncei.noaa.gov/news/global-climate-202502,Low
Video captures damage from tornado in Pico Rivera...California,tornado,2025-03-13T18:40:35,33.9830688,-118.096735,Reddit/StormComing,https://www.youtube.com/watch?v=Po_i20Zrlco,Low
California now has five reported cases of measles as of March 11. One at LAX. One attended a religious convention in Madera County where hundreds of people were in attendance.,Other,2025-03-13T03:59:49,36.7014631,-118.755997,Reddit/StormComing,https://www.latimes.com/california/story/2025-03-11/measles-case-confirmed-los-angeles-county-lax-exposure,Low
Measles contamination at Washington Dulles International Airport by a Maryland resident during and after flight. Measles is highly contagious- lasts in air 2+ hours.,Other,2025-03-12T22:58:16,39.5162401,-76.9382069,Reddit/StormComing,https://www.nbcwashington.com/news/local/maryland-resident-has-measles-after-returning-from-international-travel/3862456/,Moderate
Microplastics in the brain: Alarming new details revealed,Other,2025-03-12T16:50:53,,,Reddit/StormComing,https://www.earth.com/news/microplastics-in-the-brain-alarming-new-details-revealed/,Low
Sierra Madre residents are preparing for any potential storm-related damages amid an evacuation warning due to possible mudslides.,landslide,2025-03-12T03:41:16,,,Reddit/StormComing,https://youtu.be/cUAbjbR5Rqg?si=dtgPxarfAONBUEvk,Low
"It's been a warm winter, and California’s snowpack shows it",Other,2025-02-28T19:33:58,36.7014631,-118.755997,Reddit/Drought,https://www.latimes.com/environment/story/2025-02-28/california-snowpack-water-reservoirs-february-storms,Low
"In California, which routinely has droughts, how expensive does water have to get before people won't shower?",drought,2025-02-03T04:47:22,36.7014631,-118.755997,Reddit/Drought,https://www.reddit.com/r/drought/comments/1igh83t/in_california_which_routinely_has_droughts_how/,Low
"Extreme Drought expands in LA County after 'abysmal"" start to water year",drought,2025-01-27T03:34:16,38.4651663,-100.4776682,Reddit/Drought,https://www.nbclosangeles.com/news/california-wildfires/la-drought-map/3613304/,Low
dear ✍️Farm Bureau,Other,2025-01-22T15:53:27,,,Reddit/Drought,https://www.reddit.com/gallery/1i7e8qo,Low
Madagascar's huge ocean algae bloom was caused by dust from drought-stricken southern Africa,drought,2024-11-22T08:58:25,11.5024338,17.7578122,Reddit/Drought,https://phys.org/news/2024-11-madagascar-huge-ocean-algae-bloom.html,Low
Why future droughts will not be about rain,drought,2024-11-09T19:54:57,,,Reddit/Drought,https://www.washingtonpost.com/climate-environment/2024/11/06/droughts-heat-rainfall-future/,Low
These maps show drought levels across the U.S. are notably high for this time of year,drought,2024-10-27T21:51:13,39.7837304,-100.445882,Reddit/Drought,https://www.washingtonpost.com/weather/2024/10/24/us-drought-dry-conditions-east-maps/,Low
Water Flow in Texas San Marcos River Plummets to 'Concerning' Low Levels,Other,2024-10-27T09:35:38,31.2638905,-98.5456116,Reddit/Drought,https://www.newsweek.com/water-flow-popular-texas-river-plummets-concerning-low-levels-1974344,Low
New Interactive Esri Drought Aware app shows areas of water stress in advance detail,drought,2024-10-25T15:49:04,,,Reddit/Drought,https://www.reddit.com/r/drought/comments/1gbxfrx/new_interactive_esri_drought_aware_app_shows/,Low
An Alarming Glimpse Into a Future of Historic Droughts,drought,2024-10-19T13:56:24,,,Reddit/Drought,https://www.nytimes.com/2024/10/19/world/americas/south-america-drought-amazon-river.html,Low
