title,disaster_type,date,latitude,longitude,source,url,severity
Green flood alert in Argentina,flood,2025-03-05T16:02:56,-37.1347597,-62.79002375,GDACS,https://www.gdacs.org/report.aspx?eventtype=FL&eventid=1103151,Unknown
"Green earthquake alert (Magnitude 5.4M, Depth:26.072km) in Indonesia 14/03/2025 11:13 UTC, 390 thousand in 100km.",earthquake,2025-03-14T11:34:31,1.1364,120.2317,GDACS,https://www.gdacs.org/report.aspx?eventtype=EQ&eventid=1472298,Unknown
"Green earthquake alert (Magnitude 4.5M, Depth:509.832km) in [unknown] 14/03/2025 10:26 UTC, No people affected in 100km.",earthquake,2025-03-14T10:48:23,-24.8226,179.9724,GDACS,https://www.gdacs.org/report.aspx?eventtype=EQ&eventid=1472295,Unknown
"Green earthquake alert (Magnitude 4.6M, Depth:43.213km) in Indonesia 14/03/2025 09:52 UTC, 410 thousand in 100km.",earthquake,2025-03-14T10:38:48,-3.4571,140.5047,GDACS,https://www.gdacs.org/report.aspx?eventtype=EQ&eventid=1472294,Unknown
"Drought is on going in China, Vietnam",drought,2024-10-28T14:10:03,27.54,113.497,GDACS,https://www.gdacs.org/report.aspx?eventtype=DR&eventid=1017173,Unknown
"M 1.5 - 11 km ENE of Nikolaevsk, Alaska",earthquake,2025-03-14T12:42:24.936000,,,USGS,https://earthquake.usgs.gov/earthquakes/eventpage/ak0253cxm842,Unknown
"M 1.5 - 54 km WNW of Ninilchik, Alaska",earthquake,2025-03-14T12:11:39.123000,,,USGS,https://earthquake.usgs.gov/earthquakes/eventpage/ak0253cxfj2x,Unknown
"M 0.8 - 7 km NW of The Geysers, CA",earthquake,2025-03-14T12:06:25.957000,,,USGS,https://earthquake.usgs.gov/earthquakes/eventpage/nc75148656,Unknown
"M 0.9 - 24 km SSW of La Quinta, CA",earthquake,2025-03-14T12:06:52.639000,,,USGS,https://earthquake.usgs.gov/earthquakes/eventpage/ci41079384,Unknown
"M 1.3 - 61 km SSE of Denali National Park, Alaska",earthquake,2025-03-14T11:55:20.858000,,,USGS,https://earthquake.usgs.gov/earthquakes/eventpage/ak0253cx3ixs,Unknown
Trump axes program designed to save America from natural disasters - Daily Mail,Other,2025-03-12T20:38:31,39.7837304,-100.445882,Google News,https://news.google.com/rss/articles/CBMixwFBVV95cUxPbDRNR1diVWZhSVM1bnFyMlRFdVVCMmd3ZlVTUFA0VHVCRG1EQ3ZTMGJTTGRwTzJDVVRCZ3FWLXFoUkU2Z0FfTDM0dF96VG5RODBfT1NnWjlzUkhkWmZpMUlILVJ5UjhBc2lTQmZFckRqRVpQalp2Wm5DOU1HR3NISDVydUs3bFVLTUZYZDF2TEItck1naW9vdHJwd2FkQUJLeU5fNkMzSnVVeDlHd1pXU3NVdlRVNnI0X1pyYktyd090eFRjQTBB0gHMAUFVX3lxTE9QY2ZLbFhOVmtuM2pXRHdyUzk4TjFydll3ZktYdC1OT19lQ0s1UndRQXZrYnZqRjI4RGVDazVmYjFxLTlaVVZCUWQ3RXZBeFpNV3hKd1h0N1RnRFRBdmNWT3d1ZTN2eHBoT0t4U2NOMEdiZVY3aHZpcFpIelFibi1jUE42RkRFSlp2V2dPOHZHbWktOEVhMU5wbmlyNnlMMnpjelcyZXF4akhrWlVHLVJxV3pUVmdNclIteHJBd3JKMkRqdkc1NktLRTc1WQ?oc=5,Unknown
We can’t keep relying on the ADF to respond to natural disasters – how to rebuild our emergency volunteer workforce - The Conversation Indonesia,Other,2025-03-13T02:22:00,,,Google News,https://news.google.com/rss/articles/CBMi4AFBVV95cUxNdGN3R2JUZEdzUmVNY21lR3FGc3dCalpLZ2Z3dzVXZ0ZmdG0yZk15TUI1YXVaZDRna1BsN0FnLVJZNkxZNmh3VUx5Z3M5Y1ZsYUxLVTY5UWhLR2pOWGhseU93aUhxOWZza2pVem5GUFFwblE4eTJ5bUFrY2xNRkcyVHhTcTVTODZRLUhVU0p5TXpEQ1JDQXEtR0MxZE1SWUhUMlRiQTk0TEo1VURtdFBQUnhTUUVfZDVUYjJ3X0ZIUHpicnhlYlRDREo1WlllNnBtMlQ2TUVDV0pmUjg1M1IxNw?oc=5,Unknown
A Manager’s Guide to Supporting Employees Impacted by Natural Disasters - HBR.org Daily,Other,2025-03-14T12:32:46,,,Google News,https://news.google.com/rss/articles/CBMimgFBVV95cUxQc1hfTnNTT1hzZ1NTaFI1TERFTUdkWEFjbEJYRlRnalVXWC1MLWNCa3dvdTh2U19nWFNvMHJ0dGoyM2hQN1NpRTd1WGtjNkp5QkFIdkdhODdIYmRWN2VLTDRKeFV1ZE1rSm5CSE5WS1F4bklXTmhqNFlkakhDdWRWSm9CZUowYnZHY0VFSXVseFhJUWt5d2Q5LU5R?oc=5,Unknown
‘Trooper’s Law’ could make abandoning restrained dogs during disasters a felony in Florida - WCTV,Other,2025-03-13T22:21:50,27.7567667,-81.4639835,Google News,https://news.google.com/rss/articles/CBMivAFBVV95cUxNSW80bjRZM1RvWmxNSU9WQzhqWVpHYXI5STNyR1Q3dXNDRG1abWxqYzhWeXZMRGwxLVdjcG90eU91YnRZSnJBZEVYWmg3djdaZ2NiV2U5RUJna3p2THBLUXZFRjBUYlV6N3JBUldQQWF1VFdMMlBPWEVfVFppWDBJVzhYQkpnWXROV2Rtb2MyNWQ1ZFVPZ05iU0s3SC1aaFFCTkdUQ1Y3dVIxS1JBZElwc2RnM19wcWJ5QVhJNw?oc=5,Unknown
How Natural Disasters are Upending Insurance and Transforming the Labor Market - SHRM,Other,2025-03-10T07:00:00,,,Google News,https://news.google.com/rss/articles/CBMiswFBVV95cUxOTkNnT1c4Vnl4SXNQc2JuMzdnbGlzN2p1WEdWcU9kNHJsVXJTSDEySWNFZ0tLdmRpU0E1djAtaHNwcHNqMGw5aXVnVHhSUXQ3RWRSak90Y0gyWHNvRXpIQVdSWjhPaXVyNEstS0d2WS1MamVCclhwT3ZfTm4zWDE5SXFJS3Q4Vzk2cVlXeXM4RGV5SDFaX0FsamFqOEg1c1ZSWnRxa01EVFZOZEE0ZGE5NEJxNA?oc=5,Unknown
"🌏 Minahassa Peninsula, Sulawesi: Gempa bumi - Lindu - Earthquake (5.0 Mgqm, at 11:13 UTC)",earthquake,2025-03-14T11:19:33,,,Reddit/earthquakes,https://www.reddit.com/r/Earthquakes/comments/1jb1jdn/minahassa_peninsula_sulawesi_gempa_bumi_lindu/,Low
Sudden increase in activity Thera Station Santorini,Other,2025-03-14T09:05:22,,,Reddit/earthquakes,https://i.redd.it/lovrr5o8fmoe1.jpeg,Low
"🌎 Central Peru: Sismo - Earthquake (5.0 Mb, at 04:04 UTC)",earthquake,2025-03-14T04:38:42,,,Reddit/earthquakes,https://www.reddit.com/r/Earthquakes/comments/1javyfd/central_peru_sismo_earthquake_50_mb_at_0404_utc/,Low
"🌏 Off East Coast Of Kamchatka: Землетрясение - Earthquake (5.0 M, at 04:11 UTC)",earthquake,2025-03-14T04:24:21,,,Reddit/earthquakes,https://www.reddit.com/r/Earthquakes/comments/1javq18/off_east_coast_of_kamchatka_землетрясение/,Low
9.0 Mag Earthquake in Washington State,earthquake,2025-03-14T03:56:30,47.2868352,-120.212613,Reddit/earthquakes,https://www.reddit.com/r/Earthquakes/comments/1jav8b5/90_mag_earthquake_in_washington_state/,Low
Naples struck by 4.4-magnitude quake causing minor damage and light injuries,Other,2025-03-14T03:14:56,40.8358846,14.2487679,Reddit/earthquakes,https://apnews.com/article/italy-naples-quake-phlegrean-fields-volcano-3d6b83d13d91bdafa3ecc4469ac24886,Low
"🌎 Northern Alaska: Earthquake (5.1 Mgqm, at 22:04 UTC)",earthquake,2025-03-13T22:14:51,,,Reddit/earthquakes,https://www.reddit.com/r/Earthquakes/comments/1jaocrz/northern_alaska_earthquake_51_mgqm_at_2204_utc/,Low
"🌏 Kashmir-India Border Region: भूकंप - Earthquake (5.1 Mgqm, at 21:20 UTC)",earthquake,2025-03-13T21:25:32,,,Reddit/earthquakes,https://www.reddit.com/r/Earthquakes/comments/1jan7ye/kashmirindia_border_region_भकप_earthquake_51_mgqm/,Low
ShakeAlert (EEW for the U.S. West Coast) is down,Other,2025-03-13T18:53:37,39.7837304,-100.445882,Reddit/earthquakes,https://i.redd.it/qnc72a1a7ioe1.jpeg,Low
"🌏 Banda Sea: Gempa bumi - Lindu - Earthquake (5.0 Mgqm, at 15:45 UTC)",earthquake,2025-03-13T15:48:46,,,Reddit/earthquakes,https://www.reddit.com/r/Earthquakes/comments/1jaf3uq/banda_sea_gempa_bumi_lindu_earthquake_50_mgqm_at/,Low
How Can We Make Home Restoration More Eco-Friendly?,Other,2025-03-13T05:17:54,,,Reddit/naturaldisasters,https://www.reddit.com/r/NaturalDisasters/comments/1ja4raj/how_can_we_make_home_restoration_more_ecofriendly/,Low
Hurricane Preparedness,hurricane,2025-03-06T11:51:11,,,Reddit/naturaldisasters,/r/u_Dismal_Competition93/comments/1j37zim/hurricane_preparedness/,Low
People Affected by Natural Disasters,Other,2025-03-04T17:55:55,,,Reddit/naturaldisasters,/r/u_AlgaeZealousideal224/comments/1j3gvns/people_affected_by_natural_disasters/,Low
2 house fires within 3 years,Other,2025-03-04T01:12:33,,,Reddit/naturaldisasters,https://www.reddit.com/r/NaturalDisasters/comments/1j2ywxi/2_house_fires_within_3_years/,Low
Cooling Technology for Medicine Research,Other,2025-03-03T02:03:51,,,Reddit/naturaldisasters,https://www.reddit.com/r/NaturalDisasters/comments/1j27unb/cooling_technology_for_medicine_research/,Low
Altadena fire,Other,2025-02-26T03:33:44,,,Reddit/naturaldisasters,https://i.redd.it/6hhnlqohlele1.jpeg,Low
Natural Disaster Prediction,Other,2025-02-19T15:09:19,,,Reddit/naturaldisasters,https://www.reddit.com/r/NaturalDisasters/comments/1it7nvn/natural_disaster_prediction/,Low
"Can AI and traditional knowledge together revolutionize earthquake prediction?""",earthquake,2025-02-17T05:48:50,,,Reddit/naturaldisasters,https://www.reddit.com/r/NaturalDisasters/comments/1ircwzr/can_ai_and_traditional_knowledge_together/,Low
Texas Monthly: The Panhandle Is Burning. Can Ranching Survive?,Other,2025-02-13T18:46:25,31.2638905,-98.5456116,Reddit/naturaldisasters,https://www.reddit.com/r/NaturalDisasters/comments/1ioq9rl/texas_monthly_the_panhandle_is_burning_can/,Low
Ideas for a science comp,Other,2025-02-13T16:50:27,,,Reddit/naturaldisasters,https://www.reddit.com/r/NaturalDisasters/comments/1ionhxz/ideas_for_a_science_comp/,Low
ARE YOU READY FOR THE BIG ONE? OR READY FOR ANYTHING?,Other,2025-03-05T02:56:11,,,Reddit/disasters,https://youtube.com/watch?v=ITkItTYcW6k&si=9TmoXcIOHJxsTi3Y,Low
Aid Arena podcast,Other,2025-02-26T19:23:24,,,Reddit/disasters,https://www.youtube.com/live/AqyKZ_pqSOU?feature=shared,Low
Aid Arena,Other,2025-02-20T19:02:15,,,Reddit/disasters,https://i.redd.it/nle4mf3jdcke1.jpeg,Low
Flood and Snow #KetuckyFlood Extreme cold following weekend flooding. Many have lost electricity.,flood,2025-02-18T21:01:17,,,Reddit/disasters,https://v.redd.it/1ohydowyoyje1,Low
Support People Kentucky Flood No Electricity For Many,flood,2025-02-18T19:49:21,,,Reddit/disasters,https://v.redd.it/mkgdiqp8cyje1,Low
Kentucky Flood,flood,2025-02-17T20:00:34,,,Reddit/disasters,https://v.redd.it/n1bb6tma9rje1,Low
Support Victims of Kentucky's Deadly Flood,flood,2025-02-17T17:00:53,37.5726028,-85.1551411,Reddit/disasters,https://v.redd.it/e4r7b358dqje1,Low
"A powerful earthquake crisis continues to shake Santorini, with residents fleeing and tourists stranded. Over 70% of locals have evacuated, while authorities fear a potential larger quake or volcanic eruption. Stay updated on this unfolding disaster and its impact on the iconic island.",earthquake,2025-02-06T02:07:11,,,Reddit/disasters,https://equifi.blogspot.com/2025/02/santorini-earthquake-crisis-two-weeks.html,Low
"🌪️ Strait of Messina, Italy – February 2, 2025 – Twin waterspouts spotted over the sea.",Other,2025-02-02T15:20:54,38.1937571,15.5542082,Reddit/disasters,https://v.redd.it/81zxughgtqge1,Low
Kentucky Flood,flood,2025-01-30T21:46:39,,,Reddit/disasters,https://youtu.be/Uc2Ou8yHEU8?si=F01MvGQ4jzGfbPGv,Low
Weather Anxiety? Read this.,Other,2025-03-14T11:53:21,,,Reddit/weather,https://www.reddit.com/r/weather/comments/1jb2411/weather_anxiety_read_this/,Low
I Am So Scared.,Other,2025-03-14T11:42:44,,,Reddit/weather,https://www.reddit.com/r/weather/comments/1jb1xjf/i_am_so_scared/,Low
Anxiety posts,Other,2025-03-14T10:20:32,,,Reddit/weather,https://www.reddit.com/r/weather/comments/1jb0np6/anxiety_posts/,Low
High Winds,Other,2025-03-14T09:46:15,,,Reddit/weather,https://i.redd.it/y724qegjmmoe1.jpeg,Low
The beta version of the National Weather Service's new website has been deactivated until further notice due to the loss of critical staff,Other,2025-03-14T09:26:38,,,Reddit/weather,https://i.redd.it/kwh9jceximoe1.png,Low
SPC Day 1 Outlook - Moderate Risk,Other,2025-03-14T05:57:38,,,Reddit/weather,https://i.redd.it/6evbccnohloe1.gif,Low
How will quantum computing change weather forecasting?,Other,2025-03-14T03:28:30,,,Reddit/weather,https://www.reddit.com/r/weather/comments/1jauql2/how_will_quantum_computing_change_weather/,Low
Is Chicago weather reporting wrong?,Other,2025-03-14T03:12:25,41.8755616,-87.6244212,Reddit/weather,https://www.reddit.com/r/weather/comments/1jaufzs/is_chicago_weather_reporting_wrong/,Low
please help,Other,2025-03-14T02:52:01,,,Reddit/weather,https://www.reddit.com/r/weather/comments/1jau2l6/please_help/,Low
"Timelapse of a thunderstorm that rolled through Portland, Oregon today.",storm,2025-03-14T01:23:31,45.5202471,-122.674194,Reddit/weather,https://v.redd.it/8fteapcq4koe1,Low
UK hoping to work with China to counteract Trump’s climate-hostile policies,Other,2025-03-14T12:27:43,6.3110548,20.5447525,Reddit/climate,https://www.theguardian.com/environment/2025/mar/14/uk-hoping-to-work-with-china-to-counteract-trumps-climate-hostile-policies?CMP=Share_AndroidApp_Other,Low
"% of adults who are somewhat or very worried about global warming (nat'l avg. 63%), 2024",Other,2025-03-14T11:35:32,,,Reddit/climate,https://climatecommunication.yale.edu/visualizations-data/ycom-us-2024/,Low
"TIAA is furthering the climate crisis with $78 billion in coal, oil, and gas + deforestation + Exxon, Tesla, Bunge, Adani etc. Fossil fuels are a driving cause of the climate crisis. Most educators and nonprofits use TIAA because they brand themselves as responsible and ethical (+ schools offer it).",Other,2025-03-14T11:08:41,12.8668971,5.4545598,Reddit/climate,https://www.forbes.com/sites/mariannekrasny/2025/03/06/climate-risk-and-prudential-fiduciaries-tiaa-vs-tiaa-divest/,Low
'Significant risk’: How climate change made UK wildfires 6 times more likely,wildfire,2025-03-14T10:43:34,6.3110548,20.5447525,Reddit/climate,https://www.euronews.com/green/2025/03/13/significant-risk-how-climate-change-made-uk-wildfires-6-times-more-likely,Low
Scientists brought to tears by huge loss of U.S. butterflies | 22% decline between 2000 and 2020; similar trends expected in Canada,Other,2025-03-14T10:14:59,39.7837304,-100.445882,Reddit/climate,https://www.cbc.ca/news/science/butterfly-loss-1.7476479,Low
The American Beef Industry Understood Its Climate Impact Decades Ago | New research finds the industry’s campaigns to confuse the public about beef’s climate impact go back longer than previously recognized.,Other,2025-03-14T09:49:43,,,Reddit/climate,https://insideclimatenews.org/news/14032025/american-beef-industry-knew-climate-impact-decades-ago/,Low
"It's time to stop being surprised by surprising weather. Progress in climate science is increasingly helping us to anticipate ""unprecedented weather"" events despite common media stories emphasising their surprise nature.",Other,2025-03-14T09:25:03,,,Reddit/climate,https://www.universetoday.com/articles/its-time-to-stop-being-surprised-by-surprising-weather,Low
Man crafts stunning 'hodgepodge' tiny home using only reclaimed materials: 'Built for the cost of two years' rent',Other,2025-03-14T05:26:22,,,Reddit/climate,https://www.goodgoodgood.co/articles/hodgepodge-tiny-home-australia,Low
Pete Hegseth’s Climate Change ‘Crap’ - The secretary of defense chooses to ignore a major national security threat.,Other,2025-03-14T03:36:59,,,Reddit/climate,https://www.thebulwark.com/p/pete-hegseth-climate-change-crap-national-security-military-strategic,Low
"Facing Trump tariff threats, governments and companies are proposing major investments in American liquefied merhane gas projects.",Other,2025-03-14T02:55:49,,,Reddit/climate,https://www.nytimes.com/2025/03/13/climate/trump-tariff-natural-gas-investment.html?unlocked_article_code=1.304.A2j_.8Sf1-qlse0QL,Low
"Mainland China calls for legal improvements to fight Taiwan independence, foreign forces",Other,2025-03-14T12:45:29,35.0000663,104.999955,Reddit/worldnews,https://www.scmp.com/news/china/politics/article/3302380/zhao-leji-calls-legal-improvements-fight-taiwan-independence-foreign-forces?module=top_story&pgtype=homepage,Low
Canada wins major victory as trade panel says dairy quotas don't limit U.S. access,Other,2025-03-14T12:37:51,61.0666922,-107.991707,Reddit/worldnews,https://financialpost.com/news/economy/canada-dairy-quotas-dont-unfairly-limit-us-access,Low
"Putin still seeks control over Ukraine despite US peace efforts, WP reports",Other,2025-03-14T12:36:08,49.4871968,31.2718321,Reddit/worldnews,https://kyivindependent.com/putin-still-seeks-control-over-ukraine-despite-us-peace-efforts-wp-reports/,Low
Oh no.,Other,2025-03-14T12:32:50,,,Reddit/worldnews,https://www.bbc.com/news/articles/c201z4lv5xxo,Low
"Russian Favorability Toward U.S. Nearly Doubles Since Trump’s Return, Survey Finds",Other,2025-03-14T12:30:38,,,Reddit/worldnews,https://www.themoscowtimes.com/2025/03/14/russian-favorability-toward-us-nearly-doubles-since-trumps-return-survey-finds-a88359,Low
Germany’s Merz secures breakthrough on gargantuan spending plan,Other,2025-03-14T12:26:22,51.1638175,10.4478313,Reddit/worldnews,https://www.politico.eu/article/germanys-merz-secures-breakthrough-on-historic-spending-plan/,Low
Finnish court sentences Russian neo-Nazi to life in prison for war crimes in Ukraine,Other,2025-03-14T12:22:43,49.4871968,31.2718321,Reddit/worldnews,https://novayagazeta.eu/articles/2025/03/14/finnish-court-sentences-russian-neo-nazi-to-life-in-prison-for-war-crimes-in-ukraine-en-news,Low
"Saudi megacity NEOM to cost almost $9 trillion, take over 50 years to build, internal audit warns",Other,2025-03-14T12:22:11,28.0058861,35.2027014,Reddit/worldnews,https://www.middleeastmonitor.com/20250314-saudi-megacity-neom-to-cost-almost-9-trillion-take-over-50-years-to-build-internal-audit-warns/,Low
"Hamas to release American hostage in Gaza, ready for second-phase ceasefire talks",Other,2025-03-14T12:09:02,-23.328398,32.8066057,Reddit/worldnews,https://www.reuters.com/world/middle-east/hamas-release-american-hostage-gaza-ready-second-phase-ceasefire-talks-2025-03-14/,Low
Donald Trump makes Chinese stocks (somewhat) great again,Other,2025-03-14T12:05:57,,,Reddit/worldnews,https://www.reuters.com/markets/asia/donald-trump-makes-chinese-stocks-somewhat-great-again-2025-03-14/,Low
Fierce protests as eight-year-old rape victim dies in Bangladesh,Other,2025-03-14T12:06:07,24.4769288,90.2934413,Reddit/news,https://www.bbc.com/news/articles/ce30k9g6x2eo,Moderate
‘Ruined this place’: chorus of boos against JD Vance at Washington concert,Other,2025-03-14T06:35:30,38.8950368,-77.0365427,Reddit/news,https://www.theguardian.com/world/2025/mar/14/jd-vance-booed-national-symphony-orchestra-concert-washington-kennedy-center,High
Influencer who snatched baby wombat leaves Australia,Other,2025-03-14T06:16:26,-24.7761086,134.755,Reddit/news,https://www.abc.net.au/news/2025-03-14/sam-jones-baby-wombat-video-leaves-australia/105051630,High
US meat trade days away from getting 'kicked out' of China,Other,2025-03-14T06:11:54,39.7837304,-100.445882,Reddit/news,https://www.abc.net.au/news/2025-03-14/3-billion-united-states-meat-trade-to-china-at-risk/105052220,High
School employee accused of inappropriate relationship with student,Other,2025-03-14T04:34:57,,,Reddit/news,https://www.wsfa.com/2025/02/23/school-employee-accused-inappropriate-relationship-with-student/?utm_source=taboola&utm_medium=organicclicks,High
Apple accused of discrimination for telling employee to stop wearing jewellery supporting Gaza,Other,2025-03-14T04:06:57,-23.328398,32.8066057,Reddit/news,https://www.abc.net.au/news/2025-03-13/apple-accused-discrimination-jewellery-supporting-gaza/105042996,High
"Judge Chutkan demands ‘some kind of evidence’ from Trump’s EPA to halt climate grants. ""You can't even tell me what the evidence of malfeasance is.""",Other,2025-03-13T23:38:45,,,Reddit/news,https://www.theguardian.com/us-news/2025/mar/13/epa-grants-trump-judge-tanya-chutkan,High
"Federal Cuts Prompt Johns Hopkins to Cut More Than 2,000 Workers",Other,2025-03-14T02:23:52,,,Reddit/news,https://www.nytimes.com/2025/03/13/us/trump-cuts-johns-hopkins-university-layoffs.html?unlocked_article_code=1.304.EFUS.chI-h1pFmD5L&smid=nytcore-android-share,High
Stolen Telsa Driven Into Calgary's Bow River,Other,2025-03-14T00:56:12,51.56867131223399,-116.32058218297865,Reddit/news,https://www.ctvnews.ca/calgary/article/stolen-tesla-drives-into-calgarys-bow-river/,High
Seattle man shot in argument after throwing chicken bone out car window,Other,2025-03-13T21:24:22,47.6038321,-122.330062,Reddit/news,https://www.fox13seattle.com/news/seattle-shot-argument-chicken-bone,High
What is the best radar to watch during during severe weather?,Other,2025-03-14T12:31:31,,,Reddit/tornado,https://www.reddit.com/r/tornado/comments/1jb2sl0/what_is_the_best_radar_to_watch_during_during/,Low
Where is the safest spot to shelter in place in my home?,Other,2025-03-14T12:26:18,,,Reddit/tornado,https://www.reddit.com/r/tornado/comments/1jb2p41/where_is_the_safest_spot_to_shelter_in_place_in/,Low
What should we expect for middle Tennessee?,Other,2025-03-14T12:10:52,35.7730076,-86.2820081,Reddit/tornado,https://www.reddit.com/r/tornado/comments/1jb2f5d/what_should_we_expect_for_middle_tennessee/,Low
The moderate risk area has moved further south to include all of south Alabama.,Other,2025-03-14T11:41:05,33.2588817,-86.8295337,Reddit/tornado,https://www.youtube.com/live/ijt8LXeB8v4?si=VE8lugyHaeNrslxn,Low
"Alabama Alert Day: Widespread severe storms including strong, long-track tornadoes are forecast f...",tornado,2025-03-14T10:51:51,33.2588817,-86.8295337,Reddit/tornado,https://youtu.be/CXUiI5MEUOY,Low
When warnings are issued,Other,2025-03-14T09:59:36,,,Reddit/tornado,https://www.reddit.com/r/tornado/comments/1jb0cvr/when_warnings_are_issued/,Low
What time are storms expected to fire today (Friday),storm,2025-03-14T09:52:07,,,Reddit/tornado,https://www.reddit.com/r/tornado/comments/1jb09b4/what_time_are_storms_expected_to_fire_today_friday/,Low
March 14/15 Severe Weather Megathread,Other,2025-03-14T09:42:48,,,Reddit/tornado,https://www.reddit.com/r/tornado/comments/1jb04t2/march_1415_severe_weather_megathread/,Low
12am Sat Morning Hodograph model near St. Louis,Other,2025-03-14T09:39:05,38.6280278,-90.1910154,Reddit/tornado,https://i.redd.it/f12ld9c9lmoe1.jpeg,Low
Where to Evacuate?,Other,2025-03-14T09:24:18,,,Reddit/tornado,https://www.reddit.com/r/tornado/comments/1jazw1y/where_to_evacuate/,Low
Completely Scary.,Other,2025-03-12T22:09:35,,,Reddit/hurricane,https://i.redd.it/d6ko5zzb1coe1.png,Low
i will be doing a series of polls over the intensity of the 2024 north atlantic storms starting with alberto,storm,2025-03-12T19:12:18,39.5143268,-74.6632883,Reddit/hurricane,https://www.reddit.com/r/hurricane/comments/1j9s5tm/i_will_be_doing_a_series_of_polls_over_the/,Low
"with the nhcs official estimate of 150 mph for hurricane kirk, do you believe it was a cat 5",hurricane,2025-03-12T03:30:53,,,Reddit/hurricane,https://www.reddit.com/r/hurricane/comments/1j9a037/with_the_nhcs_official_estimate_of_150_mph_for/,Low
Have hurricanes ever fractured into two smaller hurricanes?,hurricane,2025-03-12T02:36:51,,,Reddit/hurricane,https://www.reddit.com/r/hurricane/comments/1j98z9w/have_hurricanes_ever_fractured_into_two_smaller/,Low
Hurricane names listed for 2025 Atlantic season,hurricane,2025-03-11T19:20:39,,,Reddit/hurricane,https://www.usatoday.com/story/news/weather/2025/03/11/hurricane-names-list-for-2025-atlantic-season/81924597007/,Low
Hurricane genesis locations shifting further south in Atlantic,hurricane,2025-03-11T18:09:07,39.5143268,-74.6632883,Reddit/hurricane,https://studyfinds.org/hurricanes-shifting-south-threats-caribbean-us-coastlines/,Low
We could rename it every year,Other,2025-03-08T19:20:33,,,Reddit/hurricane,https://i.redd.it/xbp9m83jnine1.jpeg,High
Can a renter apply for FEMA repairs,Other,2025-03-08T15:42:41,,,Reddit/hurricane,https://www.reddit.com/r/hurricane/comments/1j6jstz/can_a_renter_apply_for_fema_repairs/,Low
Tropical Cyclone Alfred Approaches Queensland Australia,hurricane,2025-03-06T19:20:14,-24.7761086,134.755,Reddit/hurricane,https://youtu.be/1I7WMbjTl4o,Low
Seeking advice on securing small shed in TC cat 2 *details in comments*,Other,2025-03-06T05:29:14,,,Reddit/hurricane,https://www.reddit.com/gallery/1j4odoj,Low
Looking for WA DNR crew contact info,Other,2025-03-14T04:22:30,,,Reddit/wildfire,https://www.reddit.com/r/Wildfire/comments/1javow3/looking_for_wa_dnr_crew_contact_info/,Low
“I was titty man”,Other,2025-03-14T01:37:02,,,Reddit/wildfire,https://v.redd.it/qp0erw797koe1,Low
NFFE making one last push on the hill,Other,2025-03-14T01:14:27,,,Reddit/wildfire,https://i.redd.it/mnu81zt73koe1.jpeg,Low
Pretty much sums that up.,Other,2025-03-14T00:35:50,,,Reddit/wildfire,https://i.redd.it/scnft67bwjoe1.jpeg,Moderate
Lost in the freeze,Other,2025-03-13T22:39:07,,,Reddit/wildfire,https://www.reddit.com/r/Wildfire/comments/1jaowhq/lost_in_the_freeze/,Low
New Chief Same PR Tim “Fun Guy” Schultz,Other,2025-03-13T22:35:40,,,Reddit/wildfire,https://youtu.be/pBXxy31jbmM?si=5G3_sW3zxLXm_IZ0,Low
Hiring Silence,Other,2025-03-13T22:09:21,,,Reddit/wildfire,https://www.reddit.com/r/Wildfire/comments/1jao8c3/hiring_silence/,Low
How much could I make working summers during college?,Other,2025-03-13T21:44:08,,,Reddit/wildfire,https://www.reddit.com/r/Wildfire/comments/1jannfp/how_much_could_i_make_working_summers_during/,Low
Chief video just dropped.,Other,2025-03-13T20:16:30,,,Reddit/wildfire,https://www.fs.usda.gov/inside-fs/leadership/now-available-chat-chief-episode-1,Moderate
Could use some help,Other,2025-03-13T18:23:17,,,Reddit/wildfire,https://www.reddit.com/r/Wildfire/comments/1jaivd7/could_use_some_help/,Low
The Great Mississippi River Flood Footage,flood,2025-02-07T22:07:04,,,Reddit/flooding,https://youtu.be/TnB_dOAflh8?si=iKlslgAzCLKTd5Qm,Low
Chaos in France Today! Massive flash floods sweep through half of Mayotte,flood,2025-01-14T02:29:59,46.603354,1.8883335,Reddit/flooding,https://youtube.com/clip/UgkxstYuTFOZRugAA0LDLoeRS6U5_Oen126A?si=p6v-LyecqkWv9wPI,Low
At Least 89 People Remain Missing After Floods in Eastern Spain,flood,2024-11-06T20:51:31,14.649881787923087,121.08625289875997,Reddit/flooding,https://www.theguardian.com/world/2024/nov/05/at-least-89-people-remain-missing-after-floods-in-eastern-spain,Low
Black Bird on flood debris Falls Park Sioux Falls SD. 6-21-2024,flood,2024-11-03T05:08:12,,,Reddit/flooding,https://youtube.com/shorts/0cFVu2b66OU?si=U7vNAlXI1WGDVm60,Low
"Scenes of piled-up vehicles in Valencia, Spain today after yesterday’s devastating flooding.",flood,2024-10-30T13:23:59,39.4697065,-0.3763353,Reddit/flooding,https://i.redd.it/t26u0yh2wvxd1.jpeg,Low
